{"$schema":"https://json-schema.org/draft/2020-12/schema","title":"WTS SmartScore Script Package","type":"object","required":["script_id","pages","completion_state"],"properties":{"script_id":{"type":"string"},"student_ref":{"type":["string","null"]},"subject":{"type":["string","null"]},"pages":{"type":"array","items":{"type":"object","required":["page_id","page_number","image"],"properties":{"page_id":{"type":"string"},"page_number":{"type":"integer","minimum":1},"image":{"type":"string"},"captured_at":{"type":"string"}}}},"completion_state":{"enum":["IN_PROGRESS","COMPLETE"]}}}
