{"script_id":"SCRIPT-DEMO-001","student_ref":"TEST-STU-001","subject":"Economics","completion_state":"COMPLETE","pages":[{"page_id":"PAGE-001","page_number":1,"image":"pages/001.jpg","captured_at":"2026-08-26T07:20:00+01:00"},{"page_id":"PAGE-002","page_number":2,"image":"pages/002.jpg","captured_at":"2026-08-26T07:20:07+01:00"},{"page_id":"PAGE-003","page_number":3,"image":"pages/003.jpg","captured_at":"2026-08-26T07:20:14+01:00"}]}
